<?xml version="1.0" encoding="utf-8"?>
<xs:schema xmlns:xs="http://www.w3.org/2001/XMLSchema">
  <xs:element name="Datatable" />
  <xs:element name="GroundBattleStrategyDefinition" nillable="true" type="GroundBattleStrategyDefinition" />
  <xs:complexType name="GroundBattleStrategyDefinition">
    <xs:complexContent mixed="false">
      <xs:extension base="DatatableElement">
        <xs:sequence>
          <xs:choice minOccurs="0" maxOccurs="unbounded">
            <xs:element minOccurs="0" maxOccurs="1" name="DatePrerequisite" type="DatePrerequisite" />
            <xs:element minOccurs="0" maxOccurs="1" name="GameSettingPrerequisite" type="GameSettingPrerequisite" />
            <xs:element minOccurs="0" maxOccurs="1" name="TechnologyPrerequisite" type="TechnologyPrerequisite" />
            <xs:element minOccurs="0" maxOccurs="1" name="PathPrerequisite" type="PathPrerequisite" />
            <xs:element minOccurs="0" maxOccurs="1" name="InterpreterPrerequisite" type="InterpreterPrerequisite" />
          </xs:choice>
          <xs:element minOccurs="0" maxOccurs="unbounded" name="SimulationDescriptorReference" type="SimulationDescriptorReference" />
          <xs:element minOccurs="0" maxOccurs="unbounded" name="InvasionEffect" type="InvasionEffect" />
        </xs:sequence>
        <xs:attribute name="Opponent" type="GroundBattleOpponent" use="required" />
      </xs:extension>
    </xs:complexContent>
  </xs:complexType>
  <xs:complexType name="DatePrerequisite">
    <xs:simpleContent>
      <xs:extension base="Prerequisite" />
    </xs:simpleContent>
  </xs:complexType>
  <xs:complexType name="Prerequisite">
    <xs:simpleContent>
      <xs:extension base="xs:string">
        <xs:attribute default="false" name="Inverted" type="xs:boolean" />
        <xs:attribute name="Flags" type="xs:string" />
      </xs:extension>
    </xs:simpleContent>
  </xs:complexType>
  <xs:complexType name="GameSettingPrerequisite">
    <xs:simpleContent>
      <xs:extension base="Prerequisite" />
    </xs:simpleContent>
  </xs:complexType>
  <xs:complexType name="PathValidityPrerequisite">
    <xs:simpleContent>
      <xs:extension base="Prerequisite" />
    </xs:simpleContent>
  </xs:complexType>
  <xs:complexType name="TechnologyPrerequisite">
    <xs:simpleContent>
      <xs:extension base="PathValidityPrerequisite">
        <xs:attribute default="false" name="UnlockHidden" type="xs:boolean" />
      </xs:extension>
    </xs:simpleContent>
  </xs:complexType>
  <xs:complexType name="PathPrerequisite">
    <xs:simpleContent>
      <xs:extension base="Prerequisite" />
    </xs:simpleContent>
  </xs:complexType>
  <xs:complexType name="InterpreterPrerequisite">
    <xs:simpleContent>
      <xs:extension base="Prerequisite" />
    </xs:simpleContent>
  </xs:complexType>
  <xs:complexType name="SimulationDescriptorReference">
    <xs:complexContent mixed="false">
      <xs:extension base="ValueType">
        <xs:attribute name="Name" type="xs:string" />
      </xs:extension>
    </xs:complexContent>
  </xs:complexType>
  <xs:complexType name="ValueType" />
  <xs:complexType name="InvasionEffect">
    <xs:sequence>
      <xs:element minOccurs="0" maxOccurs="unbounded" name="SimulationDescriptorReference" type="SimulationDescriptorReference" />
    </xs:sequence>
    <xs:attribute name="Opponent" type="GroundBattleOpponent" use="required" />
  </xs:complexType>
  <xs:simpleType name="GroundBattleOpponent">
    <xs:restriction base="xs:string">
      <xs:enumeration value="Attacker" />
      <xs:enumeration value="Defender" />
    </xs:restriction>
  </xs:simpleType>
  <xs:complexType name="DatatableElement">
    <xs:attribute name="Name" type="xs:string" />
  </xs:complexType>
</xs:schema>